section,headline,url,subsection,subsection_url,author,author_url,article_status,preview_text
Featured,Golden Gloves 12under on June 25,https://buckeyereporter.com/stories/627847504-golden-gloves-12under-on-june-25,Schools,https://buckeyereporter.com/stories/tag/34-schools,Press release submission,https://buckeyereporter.com/author/press-release-submission,top_story,Golden Gloves 12under on June 25
Featured,A Fair to Remember,https://buckeyereporter.com/stories/627847502-a-fair-to-remember,Schools,https://buckeyereporter.com/stories/tag/34-schools,Press release submission,https://buckeyereporter.com/author/press-release-submission,second_featured_story,A Fair to Remember
Featured,Trekking Turtles on June 25,https://buckeyereporter.com/stories/627847503-trekking-turtles-on-june-25,Schools,https://buckeyereporter.com/stories/tag/34-schools,,,,Trekking Turtles on June 25
Featured,Kenyon Remembers Peggy Turgeon,https://buckeyereporter.com/stories/626998171-kenyon-remembers-peggy-turgeon,Schools,https://buckeyereporter.com/stories/tag/34-schools,,,,Kenyon Remembers Peggy Turgeon
Featured,Physics professor and alumni publish article about alien suns,https://buckeyereporter.com/stories/627614983-physics-professor-and-alumni-publish-article-about-alien-suns,,,,,,
Featured,Start a New Career TODAY!,https://buckeyereporter.com/stories/627614982-start-a-new-career-today,,,,,,
Featured,The Cost of Leading While Black,https://buckeyereporter.com/stories/627614981-the-cost-of-leading-while-black,,,,,,
Featured,Social Entrepreneurship program students perform local research projects to solve community business problems,https://buckeyereporter.com/stories/626998173-social-entrepreneurship-program-students-perform-local-research-projects-to-solve-community-business-problems,,,,,,
Featured,Start a New Career TODAY!,https://buckeyereporter.com/stories/626998172-start-a-new-career-today,,,,,,
Opinions,Op-ed: Speaker's ransom,https://buckeyereporter.com/stories/619750003-op-ed-speaker-s-ransom,,,Matt Dole,https://buckeyereporter.com/author/matt-dole,,
Opinions,Joe Biden's new conservative outlook on supply chain should be encouraged,https://buckeyereporter.com/stories/617601953-joe-biden-s-new-conservative-outlook-on-supply-chain-should-be-encouraged,,,Keith Faber,https://buckeyereporter.com/author/keith-faber,,
Opinions,OPINION: Two Ohio Questions for Kamala Harris,https://buckeyereporter.com/stories/559398955-opinion-two-ohio-questions-for-kamala-harris,,,"Steve Cortes, Senior Advisor for Strategy to the Trump Campaign",https://buckeyereporter.com/author/steve-cortes-senior-advisor-for-strategy-to-the-trump-campaign,,
Opinions,OPINION: Four Ohio questions for Joe Biden,https://buckeyereporter.com/stories/557057064-opinion-four-ohio-questions-for-joe-biden,,,"Steve Cortes, Senior Advisor for Strategy to the Trump Campaign",https://buckeyereporter.com/author/steve-cortes-senior-advisor-for-strategy-to-the-trump-campaign,,
Opinions,"OP-ED: Upcoming Supreme Court case could mean higher costs, fewer health care benefits for employees and families",https://buckeyereporter.com/stories/555117375-op-ed-upcoming-supreme-court-case-could-mean-higher-costs-fewer-health-care-benefits-for-employees-and-families,,,Christopher Goff,https://buckeyereporter.com/author/christopher-goff,,
Data points,End of life: Ohio deaths during week ending July 16 did not exceed death expectancy,https://buckeyereporter.com/stories/629709821-end-of-life-ohio-deaths-during-week-ending-july-16-did-not-exceed-death-expectancy,Local Government,https://buckeyereporter.com/stories/tag/8-local-government,,,,
Data points,45 people die with COVID-19 listed as a contributing cause in Ohio during week ending July 16,https://buckeyereporter.com/stories/629685487-45-people-die-with-covid-19-listed-as-a-contributing-cause-in-ohio-during-week-ending-july-16,Local Government,https://buckeyereporter.com/stories/tag/8-local-government,,,,
Data points,200 people die from diseases of the heart in Ohio during week ending July 16,https://buckeyereporter.com/stories/629685385-200-people-die-from-diseases-of-the-heart-in-ohio-during-week-ending-july-16,Local Government,https://buckeyereporter.com/stories/tag/8-local-government,,,,
Data points,Fuel Analysis: Average Ohio driver will spend $45.92 more on gas this August,https://buckeyereporter.com/stories/629709445-fuel-analysis-average-ohio-driver-will-spend-45-92-more-on-gas-this-august,Taxes,https://buckeyereporter.com/stories/tag/224-taxes,,,,
Data points,271 people die in Ohio after taking the COVID-19 vaccine,https://buckeyereporter.com/stories/629683916-271-people-die-in-ohio-after-taking-the-covid-19-vaccine,Local Government,https://buckeyereporter.com/stories/tag/8-local-government,,,,
Data points,241 people die from cancer in Ohio during week ending July 16,https://buckeyereporter.com/stories/629685288-241-people-die-from-cancer-in-ohio-during-week-ending-july-16,Local Government,https://buckeyereporter.com/stories/tag/8-local-government,,,,
Data points,Ohio deaths did not exceed upper threshold of death expectancy during week ending July 16,https://buckeyereporter.com/stories/629631522-ohio-deaths-did-not-exceed-upper-threshold-of-death-expectancy-during-week-ending-july-16,Local Government,https://buckeyereporter.com/stories/tag/8-local-government,,,,
Data points,58 people die from cerebrovascular diseases in Ohio during week ending July 16,https://buckeyereporter.com/stories/629685097-58-people-die-from-cerebrovascular-diseases-in-ohio-during-week-ending-july-16,Local Government,https://buckeyereporter.com/stories/tag/8-local-government,,,,
Latest News,Op-ed: The clear politics of Clear Ballot Group,https://buckeyereporter.com/stories/629792219-op-ed-the-clear-politics-of-clear-ballot-group,Politics,,,,,"Special interests, George Soros and Zuckerberg-backed PACs, and dark money funding."
Latest News,Patrol Officer Examination Announcement,https://buckeyereporter.com/stories/621710711-patrol-officer-examination-announcement,Local Government,,,,,"The Civil Service Commission of Amherst, Ohio hereby gives notice for an open competitive examination for Patrol Officer."
Latest News,CCI executive director Atherley visits Texhong’s Renze Vietnam factory,https://buckeyereporter.com/stories/627988906-cci-executive-director-atherley-visits-texhong-s-renze-vietnam-factory,Business,,,,,"Bruce Atherley, executive director of Cotton Council International, was among a group of Americans in the cotton industry who recently visited the Texhong Renze Vietnam factory. Atherly was given a demonstration of the SAP software program from Texhong Renze, which accurately tacks cotton as it travels through supply chains."
Latest News,"Public Works, Utilities & Schools Committee Meeting on June 27",https://buckeyereporter.com/stories/627847590-public-works-utilities-schools-committee-meeting-on-june-27,Local Government,,,,,"Public Works, Utilities &amp; Schools Committee Meeting on June 27"
Latest News,City Council Meeting on June 27,https://buckeyereporter.com/stories/627847591-city-council-meeting-on-june-27,Local Government,,,,,City Council Meeting on June 27
Latest News,Seasonal Grounds Maintenance,https://buckeyereporter.com/stories/627847592-seasonal-grounds-maintenance,Local Government,,,,,Seasonal Grounds Maintenance
Latest News,Ashland Chamber of Commerce and Ashland Fire & Rescue Launch Business Preparedness Campaign,https://buckeyereporter.com/stories/627847501-ashland-chamber-of-commerce-and-ashland-fire-rescue-launch-business-preparedness-campaign,Local Government,,,,,Ashland Chamber of Commerce and Ashland Fire &amp; Rescue Launch Business Preparedness Campaign
Latest News,July First Friday: Downtown Art Walk on July 1,https://buckeyereporter.com/stories/627847589-july-first-friday-downtown-art-walk-on-july-1,Schools,,,,,July First Friday: Downtown Art Walk on July 1
Latest News,New Student Orientation on June 24,https://buckeyereporter.com/stories/627847506-new-student-orientation-on-june-24,Schools,,,,,New Student Orientation on June 24
Latest News,Women’s Track and Field Salutes Four Senior Student-Athletes,https://buckeyereporter.com/stories/627847505-women-s-track-and-field-salutes-four-senior-student-athletes,Sports,,,,,Women’s Track and Field Salutes Four Senior Student-Athletes
News,End of life: Ohio deaths during week ending July 16 did not exceed death expectancy,https://buckeyereporter.com/stories/629709821-end-of-life-ohio-deaths-during-week-ending-july-16-did-not-exceed-death-expectancy,Local Government,,,,,
News,45 people die with COVID-19 listed as a contributing cause in Ohio during week ending July 16,https://buckeyereporter.com/stories/629685487-45-people-die-with-covid-19-listed-as-a-contributing-cause-in-ohio-during-week-ending-july-16,Local Government,,,,,
News,200 people die from diseases of the heart in Ohio during week ending July 16,https://buckeyereporter.com/stories/629685385-200-people-die-from-diseases-of-the-heart-in-ohio-during-week-ending-july-16,Local Government,,,,,
News,"Youngstown-Warren-Boardman sees 199,300 nonfarm payroll employees in January",https://buckeyereporter.com/stories/628287615-youngstown-warren-boardman-sees-199-300-nonfarm-payroll-employees-in-january,Business,,,,,
News,"Toledo sees 293,500 nonfarm payroll employees in January",https://buckeyereporter.com/stories/628287587-toledo-sees-293-500-nonfarm-payroll-employees-in-january,Business,,,,,
News,"Springfield sees 47,400 nonfarm payroll employees in January",https://buckeyereporter.com/stories/628287556-springfield-sees-47-400-nonfarm-payroll-employees-in-january,Business,,,,,
News,Ohio ranked 42nd in-home vacancy rate in 2021,https://buckeyereporter.com/stories/627412318-ohio-ranked-42nd-in-home-vacancy-rate-in-2021,Real Estate,,,,,
News,Home vacancies in Ohio down 0.1% from 2020 to 2021,https://buckeyereporter.com/stories/625922453-home-vacancies-in-ohio-down-0-1-from-2020-to-2021,Real Estate,,,,,
News,'It's likely going to be a while until we see lower (interest) rates': Cleveland leads the nation in foreclosures,https://buckeyereporter.com/stories/624477888-it-s-likely-going-to-be-a-while-until-we-see-lower-interest-rates-cleveland-leads-the-nation-in-foreclosures,Real Estate,,,,,
News,July First Friday: Downtown Art Walk on July 1,https://buckeyereporter.com/stories/627847589-july-first-friday-downtown-art-walk-on-july-1,Schools,,,,,
News,New Student Orientation on June 24,https://buckeyereporter.com/stories/627847506-new-student-orientation-on-june-24,Schools,,,,,
News,Golden Gloves 12under on June 25,https://buckeyereporter.com/stories/627847504-golden-gloves-12under-on-june-25,Schools,,,,,
News,Women’s Track and Field Salutes Four Senior Student-Athletes,https://buckeyereporter.com/stories/627847505-women-s-track-and-field-salutes-four-senior-student-athletes,Sports,,,,,
News,Two Falcons named NWCA Scholar All-Americans,https://buckeyereporter.com/stories/627614985-two-falcons-named-nwca-scholar-all-americans,Sports,,,,,
News,Vonderhaar of Baseball Earns Elite 90 Academic Recognition Award,https://buckeyereporter.com/stories/626998175-vonderhaar-of-baseball-earns-elite-90-academic-recognition-award,Sports,,,,,
